{
  "schema": 2,
  "generated_at": "2026-10-27T02:11:12Z",
  "signed": true,
  "key_id": "catalog-1",
  "repository": "https://github.com/movieclaw/movieclaw-plugins",
  "plugins": [
    {
      "id": "cloud-115",
      "name": "115 网盘",
      "summary": "把 115 网盘接进媒体库：网盘里已有的片子直接看，新片自动上传、本地自动腾空。",
      "description": "把 115 网盘接进媒体库：扫码或浏览器 Cookie 登录，纳管已有文件夹、秒传与分片续传上传、取直链播放",
      "category": "storage",
      "author": {
        "name": "MovieClaw",
        "url": "https://github.com/movieclaw"
      },
      "homepage": "https://github.com/movieclaw/movieclaw-plugins/tree/main/plugins/cloud-115",
      "repository": "https://github.com/movieclaw/movieclaw-plugins/tree/main/plugins/cloud-115",
      "license": "GPL-3.0-or-later",
      "origin": "official",
      "icon": {
        "url": "https://github.com/movieclaw/movieclaw-plugins/releases/download/catalog/cloud-115-icon-d5961310a09fa524.svg",
        "sha256": "d5961310a09fa5242f92d64457a8a93d5561b36c0471df77f948c3423e31c00b",
        "size": 519
      },
      "screenshots": [],
      "deprecated": null,
      "feedback_url": "https://github.com/movieclaw/movieclaw-plugins/issues/new?template=plugin-feedback.yml&plugin=cloud-115",
      "downloads": 47,
      "latest": "0.1.0-beta.2",
      "latest_stable": null,
      "versions": [
        {
          "version": "0.1.0-beta.2",
          "prerelease": true,
          "released_at": "2026-10-19T10:30:37Z",
          "yanked": null,
          "notes": "- 请求改走 MovieClaw 的网络出口：主程序按请求限速，整树列举翻的每一页都排队领名额、计入每日预算，\n  大文件夹纳管不再连发几十页把 115 打到限流（#907，需要带按请求限速的 MovieClaw）；「网络与代理」里给本插件配的代理也生效了。\n",
          "changelog_url": "https://github.com/movieclaw/movieclaw-plugins/releases/tag/cloud-115-v0.1.0-beta.2",
          "source_url": "https://github.com/movieclaw/movieclaw-plugins/tree/cloud-115-v0.1.0-beta.2/plugins/cloud-115",
          "readme": {
            "url": "https://raw.githubusercontent.com/movieclaw/movieclaw-plugins/cloud-115-v0.1.0-beta.2/plugins/cloud-115/README.md",
            "sha256": "af782bde5017498d4c6bba5a13ba46e4eea40e429cc775ce30e1ebcabd1d6dd0",
            "size": 1842
          },
          "runtime": "process",
          "sdk": "^1.0",
          "requires": {
            "drive-backends": "^1.4"
          },
          "platforms": [
            "any"
          ],
          "permissions": {
            "operations": [],
            "paths": [],
            "network": true,
            "callbacks": [],
            "events": []
          },
          "web": false,
          "dependencies": {
            "lock": {
              "url": "https://raw.githubusercontent.com/movieclaw/movieclaw-plugins/cloud-115-v0.1.0-beta.2/plugins/cloud-115/requirements.lock",
              "sha256": "d8bbd424ed1f368edb1d971cdde22ab8d3a7ce673366a65fdba59558bb070f19",
              "size": 20924
            },
            "packages": [
              {
                "name": "ecdsa",
                "version": "0.19.2",
                "native": false
              },
              {
                "name": "lz4",
                "version": "4.4.5",
                "native": true
              },
              {
                "name": "p115cipher",
                "version": "0.0.6",
                "native": false
              },
              {
                "name": "p115pickcode",
                "version": "0.0.5.4",
                "native": false
              },
              {
                "name": "pycryptodome",
                "version": "4.0.1",
                "native": true
              },
              {
                "name": "python-asynctools",
                "version": "0.2.2",
                "native": false
              },
              {
                "name": "python-decotools",
                "version": "0.0.4",
                "native": false
              },
              {
                "name": "python-filewrap",
                "version": "0.3.1.1",
                "native": false
              },
              {
                "name": "python-property",
                "version": "0.0.3",
                "native": false
              },
              {
                "name": "python-undefined",
                "version": "0.0.4",
                "native": false
              },
              {
                "name": "six",
                "version": "1.17.0",
                "native": false
              }
            ]
          },
          "artifacts": [
            {
              "platform": "any",
              "filename": "cloud-115-0.1.0-beta.2.mcplugin",
              "url": "https://github.com/movieclaw/movieclaw-plugins/releases/download/cloud-115-v0.1.0-beta.2/cloud-115-0.1.0-beta.2.mcplugin",
              "sha256": "3f2f6f4d863ee2d049a0faa6577c86bc4fe5a466cc65f91c09e925f4dfb6cf13",
              "size": 46375
            }
          ]
        },
        {
          "version": "0.1.0-beta.1",
          "prerelease": true,
          "released_at": "2026-10-18T03:27:04Z",
          "yanked": null,
          "notes": "- 首次内测。扫码登录（可选登录端）与浏览器 Cookie 导入；账号容量；目录选择、整树列举与操作动态（纳管）；\n  文件核验、按播放器 User-Agent 取直链；秒传（含区间校验）与 OSS 分片续传上传；删除进 115 回收站。\n- 依赖 `p115cipher`（115 的请求加密）与 `p115pickcode`（提取码换文件 id），均为 MIT 许可，安装时经管理员批准下载。\n",
          "changelog_url": "https://github.com/movieclaw/movieclaw-plugins/releases/tag/cloud-115-v0.1.0-beta.1",
          "source_url": "https://github.com/movieclaw/movieclaw-plugins/tree/cloud-115-v0.1.0-beta.1/plugins/cloud-115",
          "readme": {
            "url": "https://raw.githubusercontent.com/movieclaw/movieclaw-plugins/cloud-115-v0.1.0-beta.1/plugins/cloud-115/README.md",
            "sha256": "af782bde5017498d4c6bba5a13ba46e4eea40e429cc775ce30e1ebcabd1d6dd0",
            "size": 1842
          },
          "runtime": "process",
          "sdk": "^1.0",
          "requires": {
            "drive-backends": "^1.4"
          },
          "platforms": [
            "any"
          ],
          "permissions": {
            "operations": [],
            "paths": [],
            "network": false,
            "callbacks": [],
            "events": []
          },
          "web": false,
          "dependencies": {
            "lock": {
              "url": "https://raw.githubusercontent.com/movieclaw/movieclaw-plugins/cloud-115-v0.1.0-beta.1/plugins/cloud-115/requirements.lock",
              "sha256": "d8bbd424ed1f368edb1d971cdde22ab8d3a7ce673366a65fdba59558bb070f19",
              "size": 20924
            },
            "packages": [
              {
                "name": "ecdsa",
                "version": "0.19.2",
                "native": false
              },
              {
                "name": "lz4",
                "version": "4.4.5",
                "native": true
              },
              {
                "name": "p115cipher",
                "version": "0.0.6",
                "native": false
              },
              {
                "name": "p115pickcode",
                "version": "0.0.5.4",
                "native": false
              },
              {
                "name": "pycryptodome",
                "version": "4.0.1",
                "native": true
              },
              {
                "name": "python-asynctools",
                "version": "0.2.2",
                "native": false
              },
              {
                "name": "python-decotools",
                "version": "0.0.4",
                "native": false
              },
              {
                "name": "python-filewrap",
                "version": "0.3.1.1",
                "native": false
              },
              {
                "name": "python-property",
                "version": "0.0.3",
                "native": false
              },
              {
                "name": "python-undefined",
                "version": "0.0.4",
                "native": false
              },
              {
                "name": "six",
                "version": "1.17.0",
                "native": false
              }
            ]
          },
          "artifacts": [
            {
              "platform": "any",
              "filename": "cloud-115-0.1.0-beta.1.mcplugin",
              "url": "https://github.com/movieclaw/movieclaw-plugins/releases/download/cloud-115-v0.1.0-beta.1/cloud-115-0.1.0-beta.1.mcplugin",
              "sha256": "88958b608374e8481f389bb11d113419db7e42588d81958d8cfead10e9eda5bb",
              "size": 45196
            }
          ]
        }
      ]
    },
    {
      "id": "douban-hot-subscribe",
      "name": "豆瓣热门自动订阅",
      "summary": "豆瓣热门榜单新进榜的片自动变订阅，季号自动选，可设评分与排除词。",
      "description": "盯住豆瓣的热门榜单（实时热门电影/剧集、口碑榜、分类榜等）：新进榜的片自动建订阅，剧集按标题里的季号订并自动续订。默认榜单里的全都订，每轮最多 5 条、没订完的下一轮接着订；库里已有的自动跳过。可调评分下限、只取前几名、排除词（综艺/短剧/预告）等口径；豆瓣条目对应多部作品或 TMDB 尚未收录的留给用户确认。",
      "category": "library",
      "author": {
        "name": "Kev1nT",
        "url": "https://github.com/Kev1nT"
      },
      "homepage": "https://github.com/movieclaw/movieclaw-plugins/tree/main/plugins/douban-hot-subscribe",
      "repository": "https://github.com/movieclaw/movieclaw-plugins/tree/main/plugins/douban-hot-subscribe",
      "license": "MIT",
      "origin": "official",
      "icon": null,
      "screenshots": [],
      "deprecated": null,
      "feedback_url": "https://github.com/movieclaw/movieclaw-plugins/issues/new?template=plugin-feedback.yml&plugin=douban-hot-subscribe",
      "downloads": 4,
      "latest": "1.1.0",
      "latest_stable": "1.1.0",
      "versions": [
        {
          "version": "1.1.0",
          "prerelease": false,
          "released_at": "2026-10-26T02:17:28Z",
          "yanked": null,